<?xml version="1.0" encoding="UTF-8"?>
<Seat xmlns:xsi="http://www.w3.org/2001/XMLSchema-instance"
 xsi:noNamespaceSchemaLocation="file:/home/tom/Opendungeons/opendungeons/xsd/SeatScheme.xsd">
        <color>5</color>
        <faction>Animals</faction>
        <startingX>15</startingX>
        <startingY>0</startingY>
        <colorR>0.4</colorR>
        <colorG>0.1</colorG>
        <colorB>0.4</colorB>
 </Seat>