<Seat xmlns:xsi="http://www.w3.org/2001/XMLSchema-instance"
      xsi:noNamespaceSchemaLocation="file:/home/tom/Opendungeons/opendungeons/xsd/SeatScheme.xsd">
        <color>1</color>
        <faction>Undead</faction>
        <startingX>-5</startingX>
        <startingY>10</startingY>
        <colorR>0</colorR>
        <colorG>0.4</colorG>
        <colorB>0</colorB>
 </Seat>